review_id,product_id,customer_id,rating,review_text,review_date
237,2,54,4,Standard believe politics also space high sister two free they its us building side section.,2025-11-05T18:31:54
238,11,120,1,Up plant place approach modern floor north force recently check purpose young wife send offer bed.,2025-05-27T14:45:13
239,47,143,4,Skill challenge from live seat nature energy huge its recently seven.,2025-06-15T15:20:38
240,48,182,1,Cup house number night young modern drug entire involve range office both including half couple.,2025-04-23T16:01:34
241,79,69,5,Pretty show college glass start sort perhaps key under do rate choose rock beat science drug.,2025-08-09T00:59:01
242,6,188,1,Than star add really born late age decade Mrs.,2025-02-28T00:23:15
243,39,20,2,Model else low role center recognize adult on professional analysis color exist smile peace apply.,2025-08-22T03:36:25
244,67,25,1,At produce production tree growth blue fall.,2025-11-18T22:43:39
245,30,137,4,Discuss herself with between firm term mother cost may leader unit again easy.,2025-07-04T11:19:48
246,25,50,5,Four hotel church get goal personal door within may speech personal.,2025-11-17T02:41:13
247,32,146,2,Three spring ahead never exactly charge today prevent because him whether partner personal.,2025-03-09T04:36:13
248,72,192,5,Drive check wife travel forget my deal catch must son television finally relate.,2025-07-02T07:02:32
249,54,192,1,Involve training show prevent north citizen attack mouth rest.,2025-02-20T09:05:09
250,74,92,4,Style certainly ahead five win which field seat start PM scene charge.,2025-02-21T20:29:22
251,55,27,2,Capital ago worry pay paper partner others discuss.,2024-12-20T23:56:47
252,24,141,4,Bag sister care suffer light power contain hold listen clearly difficult impact.,2024-12-16T16:45:51
253,65,87,2,Wear development provide dark daughter computer western keep pay reach term.,2025-11-20T13:43:51
254,69,154,4,Into simply part station result hour voice occur movie political.,2025-09-10T07:37:33
255,46,81,5,Minute later still amount yet million how.,2025-09-22T09:06:11
256,42,96,4,Newspaper might piece any fact huge fight.,2025-10-28T06:48:29
257,56,186,3,Leave institution party approach might central stop later reveal both single.,2025-12-10T02:08:47
258,78,62,5,Career including late condition opportunity Republican dark lawyer economic reality trade someone responsibility but box.,2025-06-03T09:31:05
259,70,55,4,Be religious risk window partner civil nearly analysis color friend the television.,2025-02-11T19:55:38
260,71,191,3,Condition Republican information finally shoulder land phone brother capital.,2025-02-27T15:32:10
261,47,116,4,Performance education learn talk myself accept third.,2025-03-13T06:00:30
262,51,1,1,Open little improve bag outside each natural people newspaper stay.,2024-12-29T20:46:39
263,37,153,1,Challenge president already take project study fear turn any.,2025-05-21T19:08:29
264,67,35,3,Claim expect produce record occur no whom see growth.,2024-12-24T18:52:29
265,1,77,2,Shoulder follow today star serve successful assume likely.,2025-01-27T06:09:37
266,28,81,1,Forget including decide decade around number without more because right painting.,2025-10-12T23:14:11
267,36,142,5,Interview summer employee offer perhaps until pass market role marriage space.,2025-11-19T01:09:49
268,72,147,5,Discussion fact cover brother let someone scene debate past increase animal glass south defense political real.,2025-03-19T16:09:52
269,20,25,1,Film media food accept rate game right pattern.,2024-12-22T04:12:54
270,59,92,2,Create street two look listen along career choice leave.,2025-11-11T21:17:48
271,18,68,3,Time leg sport until argue minute north question new affect officer forward trouble somebody at.,2025-02-06T20:26:38
272,75,64,2,Subject fund heart move coach paper cost bring site final tax.,2025-09-12T13:00:35
273,33,77,1,Even beautiful theory he stop few modern.,2025-02-16T20:03:30
274,74,103,5,Hear also dark begin media sometimes toward child.,2025-04-21T22:55:52
275,28,188,1,Run model simply century the state visit quality car right least require mission about.,2025-12-07T22:50:07
276,42,124,2,Reach organization beautiful level animal minute probably.,2025-04-11T05:21:12
277,63,177,5,Officer fine throughout fly court everybody five.,2025-05-31T04:19:01
278,13,153,3,Evening church boy when nice bill my near even.,2025-09-10T09:52:25
279,5,188,5,Off commercial find throughout music anything ahead tough anyone himself beat.,2025-05-12T01:45:01
280,49,21,1,Relate through picture real knowledge green forward cup serve.,2025-10-21T04:02:32
281,43,90,4,Bad type share nothing behavior sort recognize best financial popular short like water century time.,2025-03-21T02:02:50
282,54,31,2,Hot record professor small think law air little goal leave color should.,2025-08-02T14:36:45
283,78,3,4,Camera bill stage someone for power society mouth husband including per nature wind himself future.,2025-10-22T23:03:56
284,7,79,5,Issue woman note garden reason community prove school Republican student boy other foot best knowledge final.,2025-05-17T11:05:34
285,6,82,5,Our rate others star force population article design.,2025-02-02T19:37:09
286,73,39,3,Tough player a chair chance most hope official crime race first now tree fight wall itself.,2025-12-01T06:20:18
287,65,179,2,Wrong old particularly member summer system artist too whose a nice without.,2025-01-22T11:17:01
288,20,13,4,Tend dog reduce hour fish him high nation production little could.,2025-05-09T05:30:25
289,58,193,5,Style child young prove care author administration return main join wrong be.,2025-08-17T06:57:32
290,74,130,1,Team throw receive us perhaps lawyer interest star his difficult interesting account marriage.,2025-09-20T17:25:40
291,29,111,3,Republican especially unit office almost also low happy oil which.,2025-01-10T23:03:49
292,51,38,2,Room money teacher seek evidence might model particular early.,2025-08-12T19:01:30
293,44,22,4,Range much often party tough movement action law.,2025-11-27T17:52:00
294,74,191,1,Off former good within far cold reason our fight size employee picture official of.,2025-08-22T18:09:57
295,71,103,3,Speak person expert bar measure surface everyone car exactly tax add.,2025-01-23T04:32:13
296,11,103,5,Company option character land space end red machine son television garden base certain value child many.,2025-05-20T05:46:28
297,56,199,2,Draw key point decision same generation politics sense break cold human feeling second.,2025-09-29T01:57:26
298,18,124,5,Do raise hope enjoy most itself eye something high firm morning what best most government.,2025-11-03T17:42:06
299,26,125,4,Particular present evening establish sort effort once leave push drop public side mind.,2025-08-31T01:36:44
